{
  "$schema": "https://json-schema.org/draft/2020-12/schema",
  "type": "object",
  "properties": {
    "format": {
      "type": "string",
      "const": "fusionkit.translation-knowledge"
    },
    "schemaVersion": {
      "type": "number",
      "const": 2
    },
    "package": {
      "type": "object",
      "properties": {
        "id": {
          "type": "string",
          "pattern": "^[0-9a-f]{8}-[0-9a-f]{4}-4[0-9a-f]{3}-[89ab][0-9a-f]{3}-[0-9a-f]{12}$"
        },
        "revision": {
          "type": "integer",
          "minimum": 1,
          "maximum": 9007199254740991
        },
        "extensions": {
          "type": "object",
          "propertyNames": {
            "type": "string",
            "pattern": "^[a-z][a-z0-9]*(?:-[a-z0-9]+)*(?:\\.[a-z][a-z0-9]*(?:-[a-z0-9]+)*)+$"
          },
          "additionalProperties": {
            "$ref": "#/$defs/__schema0"
          }
        },
        "name": {
          "type": "string",
          "maxLength": 32768,
          "pattern": "\\S"
        },
        "description": {
          "type": "string",
          "maxLength": 32768
        },
        "createdAt": {
          "type": "string",
          "format": "date-time",
          "pattern": "^(?:(?:\\d\\d[2468][048]|\\d\\d[13579][26]|\\d\\d0[48]|[02468][048]00|[13579][26]00)-02-29|\\d{4}-(?:(?:0[13578]|1[02])-(?:0[1-9]|[12]\\d|3[01])|(?:0[469]|11)-(?:0[1-9]|[12]\\d|30)|(?:02)-(?:0[1-9]|1\\d|2[0-8])))T(?:(?:[01]\\d|2[0-3]):[0-5]\\d(?::[0-5]\\d(?:\\.\\d+)?)?(?:Z))$"
        },
        "generator": {
          "type": "object",
          "properties": {
            "name": {
              "type": "string",
              "maxLength": 32768,
              "pattern": "\\S"
            },
            "version": {
              "type": "string",
              "maxLength": 32768,
              "pattern": "\\S"
            }
          },
          "required": [
            "name"
          ],
          "additionalProperties": false
        },
        "author": {
          "type": "string",
          "maxLength": 32768,
          "pattern": "\\S"
        },
        "sharingNote": {
          "type": "string",
          "maxLength": 32768
        }
      },
      "required": [
        "id",
        "revision",
        "name",
        "description",
        "createdAt",
        "generator"
      ],
      "additionalProperties": false
    },
    "collections": {
      "maxItems": 20000,
      "type": "array",
      "items": {
        "type": "object",
        "properties": {
          "id": {
            "type": "string",
            "pattern": "^[0-9a-f]{8}-[0-9a-f]{4}-4[0-9a-f]{3}-[89ab][0-9a-f]{3}-[0-9a-f]{12}$"
          },
          "revision": {
            "type": "integer",
            "minimum": 1,
            "maximum": 9007199254740991
          },
          "extensions": {
            "type": "object",
            "propertyNames": {
              "type": "string",
              "pattern": "^[a-z][a-z0-9]*(?:-[a-z0-9]+)*(?:\\.[a-z][a-z0-9]*(?:-[a-z0-9]+)*)+$"
            },
            "additionalProperties": {
              "$ref": "#/$defs/__schema0"
            }
          },
          "name": {
            "type": "string",
            "maxLength": 32768,
            "pattern": "\\S"
          },
          "description": {
            "type": "string",
            "maxLength": 32768
          },
          "languagePair": {
            "type": "object",
            "properties": {
              "source": {
                "type": "string",
                "maxLength": 32768,
                "pattern": "\\S"
              },
              "target": {
                "type": "string",
                "maxLength": 32768,
                "pattern": "\\S"
              }
            },
            "required": [
              "source",
              "target"
            ],
            "additionalProperties": false
          },
          "archived": {
            "type": "boolean"
          }
        },
        "required": [
          "id",
          "revision",
          "name",
          "description",
          "languagePair",
          "archived"
        ],
        "additionalProperties": false
      }
    },
    "entries": {
      "maxItems": 20000,
      "type": "array",
      "items": {
        "oneOf": [
          {
            "type": "object",
            "properties": {
              "id": {
                "type": "string",
                "pattern": "^[0-9a-f]{8}-[0-9a-f]{4}-4[0-9a-f]{3}-[89ab][0-9a-f]{3}-[0-9a-f]{12}$"
              },
              "revision": {
                "type": "integer",
                "minimum": 1,
                "maximum": 9007199254740991
              },
              "extensions": {
                "type": "object",
                "propertyNames": {
                  "type": "string",
                  "pattern": "^[a-z][a-z0-9]*(?:-[a-z0-9]+)*(?:\\.[a-z][a-z0-9]*(?:-[a-z0-9]+)*)+$"
                },
                "additionalProperties": {
                  "$ref": "#/$defs/__schema0"
                }
              },
              "collectionId": {
                "type": "string",
                "pattern": "^[0-9a-f]{8}-[0-9a-f]{4}-4[0-9a-f]{3}-[89ab][0-9a-f]{3}-[0-9a-f]{12}$"
              },
              "enabled": {
                "type": "boolean"
              },
              "origin": {
                "type": "object",
                "properties": {
                  "kind": {
                    "type": "string",
                    "enum": [
                      "manual",
                      "revision",
                      "agent",
                      "web",
                      "import"
                    ]
                  },
                  "note": {
                    "type": "string",
                    "maxLength": 32768
                  },
                  "url": {
                    "type": "string",
                    "maxLength": 32768,
                    "pattern": "\\S"
                  },
                  "title": {
                    "type": "string",
                    "maxLength": 32768,
                    "pattern": "\\S"
                  },
                  "at": {
                    "type": "string",
                    "format": "date-time",
                    "pattern": "^(?:(?:\\d\\d[2468][048]|\\d\\d[13579][26]|\\d\\d0[48]|[02468][048]00|[13579][26]00)-02-29|\\d{4}-(?:(?:0[13578]|1[02])-(?:0[1-9]|[12]\\d|3[01])|(?:0[469]|11)-(?:0[1-9]|[12]\\d|30)|(?:02)-(?:0[1-9]|1\\d|2[0-8])))T(?:(?:[01]\\d|2[0-3]):[0-5]\\d(?::[0-5]\\d(?:\\.\\d+)?)?(?:Z))$"
                  }
                },
                "required": [
                  "kind"
                ],
                "additionalProperties": false
              },
              "kind": {
                "type": "string",
                "const": "term"
              },
              "payload": {
                "type": "object",
                "properties": {
                  "source": {
                    "type": "string",
                    "maxLength": 32768,
                    "pattern": "\\S"
                  },
                  "target": {
                    "type": "string",
                    "maxLength": 32768,
                    "pattern": "\\S"
                  },
                  "aliases": {
                    "type": "array",
                    "items": {
                      "type": "string",
                      "maxLength": 32768,
                      "pattern": "\\S"
                    }
                  },
                  "note": {
                    "type": "string",
                    "maxLength": 32768
                  },
                  "strength": {
                    "type": "string",
                    "enum": [
                      "required",
                      "preferred",
                      "keep_source"
                    ]
                  },
                  "match": {
                    "type": "object",
                    "properties": {
                      "mode": {
                        "type": "string",
                        "enum": [
                          "whole_term",
                          "literal_phrase"
                        ]
                      },
                      "caseSensitive": {
                        "type": "boolean"
                      }
                    },
                    "required": [
                      "mode",
                      "caseSensitive"
                    ],
                    "additionalProperties": false
                  }
                },
                "required": [
                  "source",
                  "target",
                  "aliases",
                  "note",
                  "strength",
                  "match"
                ],
                "additionalProperties": false
              }
            },
            "required": [
              "id",
              "revision",
              "collectionId",
              "enabled",
              "kind",
              "payload"
            ],
            "additionalProperties": false
          },
          {
            "type": "object",
            "properties": {
              "id": {
                "type": "string",
                "pattern": "^[0-9a-f]{8}-[0-9a-f]{4}-4[0-9a-f]{3}-[89ab][0-9a-f]{3}-[0-9a-f]{12}$"
              },
              "revision": {
                "type": "integer",
                "minimum": 1,
                "maximum": 9007199254740991
              },
              "extensions": {
                "type": "object",
                "propertyNames": {
                  "type": "string",
                  "pattern": "^[a-z][a-z0-9]*(?:-[a-z0-9]+)*(?:\\.[a-z][a-z0-9]*(?:-[a-z0-9]+)*)+$"
                },
                "additionalProperties": {
                  "$ref": "#/$defs/__schema0"
                }
              },
              "collectionId": {
                "type": "string",
                "pattern": "^[0-9a-f]{8}-[0-9a-f]{4}-4[0-9a-f]{3}-[89ab][0-9a-f]{3}-[0-9a-f]{12}$"
              },
              "enabled": {
                "type": "boolean"
              },
              "origin": {
                "type": "object",
                "properties": {
                  "kind": {
                    "type": "string",
                    "enum": [
                      "manual",
                      "revision",
                      "agent",
                      "web",
                      "import"
                    ]
                  },
                  "note": {
                    "type": "string",
                    "maxLength": 32768
                  },
                  "url": {
                    "type": "string",
                    "maxLength": 32768,
                    "pattern": "\\S"
                  },
                  "title": {
                    "type": "string",
                    "maxLength": 32768,
                    "pattern": "\\S"
                  },
                  "at": {
                    "type": "string",
                    "format": "date-time",
                    "pattern": "^(?:(?:\\d\\d[2468][048]|\\d\\d[13579][26]|\\d\\d0[48]|[02468][048]00|[13579][26]00)-02-29|\\d{4}-(?:(?:0[13578]|1[02])-(?:0[1-9]|[12]\\d|3[01])|(?:0[469]|11)-(?:0[1-9]|[12]\\d|30)|(?:02)-(?:0[1-9]|1\\d|2[0-8])))T(?:(?:[01]\\d|2[0-3]):[0-5]\\d(?::[0-5]\\d(?:\\.\\d+)?)?(?:Z))$"
                  }
                },
                "required": [
                  "kind"
                ],
                "additionalProperties": false
              },
              "kind": {
                "type": "string",
                "const": "context"
              },
              "payload": {
                "type": "object",
                "properties": {
                  "text": {
                    "type": "string",
                    "maxLength": 32768,
                    "pattern": "\\S"
                  },
                  "required": {
                    "type": "boolean"
                  }
                },
                "required": [
                  "text",
                  "required"
                ],
                "additionalProperties": false
              }
            },
            "required": [
              "id",
              "revision",
              "collectionId",
              "enabled",
              "kind",
              "payload"
            ],
            "additionalProperties": false
          },
          {
            "type": "object",
            "properties": {
              "id": {
                "type": "string",
                "pattern": "^[0-9a-f]{8}-[0-9a-f]{4}-4[0-9a-f]{3}-[89ab][0-9a-f]{3}-[0-9a-f]{12}$"
              },
              "revision": {
                "type": "integer",
                "minimum": 1,
                "maximum": 9007199254740991
              },
              "extensions": {
                "type": "object",
                "propertyNames": {
                  "type": "string",
                  "pattern": "^[a-z][a-z0-9]*(?:-[a-z0-9]+)*(?:\\.[a-z][a-z0-9]*(?:-[a-z0-9]+)*)+$"
                },
                "additionalProperties": {
                  "$ref": "#/$defs/__schema0"
                }
              },
              "collectionId": {
                "type": "string",
                "pattern": "^[0-9a-f]{8}-[0-9a-f]{4}-4[0-9a-f]{3}-[89ab][0-9a-f]{3}-[0-9a-f]{12}$"
              },
              "enabled": {
                "type": "boolean"
              },
              "origin": {
                "type": "object",
                "properties": {
                  "kind": {
                    "type": "string",
                    "enum": [
                      "manual",
                      "revision",
                      "agent",
                      "web",
                      "import"
                    ]
                  },
                  "note": {
                    "type": "string",
                    "maxLength": 32768
                  },
                  "url": {
                    "type": "string",
                    "maxLength": 32768,
                    "pattern": "\\S"
                  },
                  "title": {
                    "type": "string",
                    "maxLength": 32768,
                    "pattern": "\\S"
                  },
                  "at": {
                    "type": "string",
                    "format": "date-time",
                    "pattern": "^(?:(?:\\d\\d[2468][048]|\\d\\d[13579][26]|\\d\\d0[48]|[02468][048]00|[13579][26]00)-02-29|\\d{4}-(?:(?:0[13578]|1[02])-(?:0[1-9]|[12]\\d|3[01])|(?:0[469]|11)-(?:0[1-9]|[12]\\d|30)|(?:02)-(?:0[1-9]|1\\d|2[0-8])))T(?:(?:[01]\\d|2[0-3]):[0-5]\\d(?::[0-5]\\d(?:\\.\\d+)?)?(?:Z))$"
                  }
                },
                "required": [
                  "kind"
                ],
                "additionalProperties": false
              },
              "kind": {
                "type": "string",
                "const": "rule"
              },
              "payload": {
                "type": "object",
                "properties": {
                  "text": {
                    "type": "string",
                    "maxLength": 32768,
                    "pattern": "\\S"
                  },
                  "required": {
                    "type": "boolean"
                  }
                },
                "required": [
                  "text",
                  "required"
                ],
                "additionalProperties": false
              }
            },
            "required": [
              "id",
              "revision",
              "collectionId",
              "enabled",
              "kind",
              "payload"
            ],
            "additionalProperties": false
          }
        ]
      }
    },
    "presets": {
      "maxItems": 20000,
      "type": "array",
      "items": {
        "type": "object",
        "properties": {
          "id": {
            "type": "string",
            "pattern": "^[0-9a-f]{8}-[0-9a-f]{4}-4[0-9a-f]{3}-[89ab][0-9a-f]{3}-[0-9a-f]{12}$"
          },
          "revision": {
            "type": "integer",
            "minimum": 1,
            "maximum": 9007199254740991
          },
          "extensions": {
            "type": "object",
            "propertyNames": {
              "type": "string",
              "pattern": "^[a-z][a-z0-9]*(?:-[a-z0-9]+)*(?:\\.[a-z][a-z0-9]*(?:-[a-z0-9]+)*)+$"
            },
            "additionalProperties": {
              "$ref": "#/$defs/__schema0"
            }
          },
          "name": {
            "type": "string",
            "maxLength": 32768,
            "pattern": "\\S"
          },
          "languagePair": {
            "type": "object",
            "properties": {
              "source": {
                "type": "string",
                "maxLength": 32768,
                "pattern": "\\S"
              },
              "target": {
                "type": "string",
                "maxLength": 32768,
                "pattern": "\\S"
              }
            },
            "required": [
              "source",
              "target"
            ],
            "additionalProperties": false
          },
          "collectionIds": {
            "maxItems": 20000,
            "type": "array",
            "items": {
              "type": "string",
              "pattern": "^[0-9a-f]{8}-[0-9a-f]{4}-4[0-9a-f]{3}-[89ab][0-9a-f]{3}-[0-9a-f]{12}$"
            }
          },
          "instructions": {
            "type": "string",
            "maxLength": 32768
          },
          "context": {
            "type": "string",
            "maxLength": 32768
          }
        },
        "required": [
          "id",
          "revision",
          "name",
          "languagePair",
          "collectionIds",
          "instructions",
          "context"
        ],
        "additionalProperties": false
      }
    },
    "extensions": {
      "type": "object",
      "propertyNames": {
        "type": "string",
        "pattern": "^[a-z][a-z0-9]*(?:-[a-z0-9]+)*(?:\\.[a-z][a-z0-9]*(?:-[a-z0-9]+)*)+$"
      },
      "additionalProperties": {
        "$ref": "#/$defs/__schema0"
      }
    }
  },
  "required": [
    "format",
    "schemaVersion",
    "package",
    "collections",
    "entries",
    "presets"
  ],
  "additionalProperties": false,
  "$defs": {
    "__schema0": {
      "anyOf": [
        {
          "type": "string"
        },
        {
          "type": "number"
        },
        {
          "type": "boolean"
        },
        {
          "type": "null"
        },
        {
          "type": "array",
          "items": {
            "$ref": "#/$defs/__schema0"
          }
        },
        {
          "type": "object",
          "propertyNames": {
            "type": "string"
          },
          "additionalProperties": {
            "$ref": "#/$defs/__schema0"
          }
        }
      ]
    }
  },
  "title": "FusionKit Translation Knowledge v2",
  "x-fktk-limits": {
    "fileBytes": 33554432,
    "entities": 20000,
    "textBytes": 32768,
    "depth": 32,
    "extensionBytes": 65536,
    "diagnostics": 100
  }
}
