{
  "format": "fusionkit.translation-knowledge",
  "schemaVersion": 2,
  "package": {
    "id": "10000000-0000-4000-8000-000000000101",
    "revision": 1,
    "name": "日中直播字幕起步资料",
    "description": "虚构的日语直播常用译法，演示术语、要求与背景三种内容。",
    "createdAt": "2026-10-12T00:00:00Z",
    "generator": {
      "name": "FusionKit protocol example",
      "version": "2"
    }
  },
  "collections": [
    {
      "id": "30000000-0000-4000-8000-000000000101",
      "revision": 1,
      "name": "主播 A",
      "description": "虚构日语主播的直播用语。",
      "languagePair": {
        "source": "ja",
        "target": "zh-Hans"
      },
      "archived": false
    }
  ],
  "entries": [
    {
      "id": "50000000-0000-4000-8000-000000000101",
      "revision": 1,
      "collectionId": "30000000-0000-4000-8000-000000000101",
      "enabled": true,
      "kind": "term",
      "payload": {
        "source": "スパチャ",
        "target": "SC",
        "aliases": [
          "スーパーチャット"
        ],
        "note": "直播打赏留言。",
        "strength": "required",
        "match": {
          "mode": "literal_phrase",
          "caseSensitive": true
        }
      }
    },
    {
      "id": "50000000-0000-4000-8000-000000000102",
      "revision": 1,
      "collectionId": "30000000-0000-4000-8000-000000000101",
      "enabled": true,
      "kind": "term",
      "payload": {
        "source": "Aちゃん",
        "target": "Aちゃん",
        "aliases": [],
        "note": "主播昵称，保留原文。",
        "strength": "keep_source",
        "match": {
          "mode": "literal_phrase",
          "caseSensitive": true
        }
      }
    },
    {
      "id": "50000000-0000-4000-8000-000000000103",
      "revision": 1,
      "collectionId": "30000000-0000-4000-8000-000000000101",
      "enabled": true,
      "kind": "rule",
      "payload": {
        "text": "保留主播轻松随意的口语语气，不改写为书面语。",
        "required": true
      }
    },
    {
      "id": "50000000-0000-4000-8000-000000000104",
      "revision": 1,
      "collectionId": "30000000-0000-4000-8000-000000000101",
      "enabled": true,
      "kind": "context",
      "payload": {
        "text": "主播 A 是虚构的游戏实况主播，常与观众聊天互动。",
        "required": false
      }
    }
  ],
  "presets": []
}
